{
  "schemaVersion": 1,
  "id": "my-first-deck",
  "name": "My first deck",
  "description": "A tiny example you can edit and upload.",
  "version": "1.0.0",
  "piles": [
    {
      "id": "start",
      "label": "Start",
      "cards": [
        {
          "id": "s-s",
          "text": "s"
        },
        {
          "id": "s-m",
          "text": "m"
        },
        {
          "id": "s-sh",
          "text": "sh"
        }
      ]
    },
    {
      "id": "mid",
      "label": "Middle",
      "cards": [
        {
          "id": "v-a",
          "text": "a"
        },
        {
          "id": "v-i",
          "text": "i"
        },
        {
          "id": "v-o",
          "text": "o"
        }
      ]
    },
    {
      "id": "end",
      "label": "End",
      "cards": [
        {
          "id": "n-t",
          "text": "t"
        },
        {
          "id": "n-n",
          "text": "n"
        },
        {
          "id": "n-ck",
          "text": "ck"
        }
      ]
    }
  ],
  "rules": {
    "allowCrossPileMoves": true,
    "allowReorder": true,
    "allowFlip": false,
    "initialShuffle": false
  },
  "tags": [
    "example"
  ]
}
